Title,Authors,Contributors,ISBN/UID,Date Added,Last Date Read,Dates Read,Star Rating,Review
Erasing History: How Fascists Rewrite the Past to Control the Future,Jason Stanley,,9781668056912,11/28/2024,11/28/2024,11/28/2024,4,"<div>Erasing History by Jason Stanley--Short and chock-full of information, Stanley examines international and domestic lurches toward fascism, in his view, predominantly through the lens of restricting/controlling information. While the information he shares is fact-based, I'll share that I think some of the comparisons he makes between fascistic regimes abroad and nominally similar efforts in the States are in poor taste. With that said, Stanley makes a case that there is cause for concern in the areas of education and censorship, and, hey, I live in Oklahoma. He can't be that far off. Thumbs up.</div>"
"Circle of Hope: A Reckoning with Love, Power, and Justice in an American Church",Eliza Griswold,,9780374601683,1/25/2025,1/25/2025,1/25/2025,4,
Unit X: How the Pentagon and Silicon Valley Are Transforming the Future of War,"Christopher Kirchhoff, Raj M. Shah",,1668031388,8/16/2024,,,4,"<div>Unit X by Raj M. Shah and Christopher Kirchhoff--Weird to say, but I've never been more optimistic about the American military than after reading this book. Shah and Kirchhoff were tasked with standing up a unit in the Pentagon to remove barriers to procurement and invest in experimental startups (through POs) to help the war effort. While the perspective is biased, there's comprehensive detail of the barriers facing military procurement from the group that literally wrote the book on circumvent procurement rules. Thumbs up.</div>"
History as Mystery,Michael Parenti,,9780872863576,12/29/2023,8/2/2023,8/2/2023,4,
"The Devil and Sherlock Holmes: Tales of Murder, Madness, and Obsession",David Grann,,9780307275905,12/29/2023,6/26/2023,6/26/2023,4,
The Terraformers,Annalee Newitz,,9781250228017,12/29/2023,12/24/2023,12/24/2023,3,
"Dangerous Ideas: A Brief History of Censorship in the West, from the Ancients to Fake News",Eric Berkowitz,,9780807036242,12/28/2023,2/19/2023,2/19/2023,4,
Gregor the Overlander,Suzanne Collins,,9780439771344,12/29/2023,6/24/2023,6/24/2023,4,
"The Hank Show: How a House-Painting, Drug-Running DEA Informant Built the Machine That Rules Our Lives",McKenzie Funk,,9781250209276,11/23/2024,11/22/2024,11/22/2024,4,"<div>The Hank Show by McKenzie Funk--This is a story about Hank Asher, a drug smuggler turned data synthesizer who nearly singlehandedly constructed the modern data economy. It's also a story about the overreach of today's surveillance state. Funk convincingly, though briefly, argues that the United States has become the tech dystopia we feared from places like China or Germany and are bafflingly comfortable with this setup because of the mask this data collection wears. We are comfortable with T-Mobile collecting (and selling) our data for use by law enforcement or ad targeting in the same way that we allow Amazon or State Farm or Taco Bell or 7-Eleven to track and build profiles on us. And it all started with a cocaine smuggler...thumbs up.</div>"
Unorthodox: The Scandalous Rejection of My Hasidic Roots,Deborah Feldman,Katalin Getto (Translator),9781439187012,10/8/2024,10/7/2024,10/7/2024,4,
Star Wars: The Living Force,John Jackson Miller,,9780593597958,1/29/2025,1/29/2025,1/29/2025,4,
Agent to the Stars,John Scalzi,,9781250176516,1/13/2024,1/13/2024,1/13/2024,4,"<div>Agent to the Stars by John Scalzi--This is a fast-paced, delightfully witty book about an agent representing some of the relatively mediocre Hollywood stars who is asked by aliens to represent them as they introduce themselves to humanity. I enjoyed the skewering of the industry as a whole, while the story itself is filled with delightful mishaps and good clean fun. Thumbs up.&nbsp;</div>"
The Road to Freedom: Economics and the Good Society,Joseph E. Stiglitz,,9781324074373,6/24/2025,6/24/2025,6/24/2025,4,
Comfort Me with Apples,Catherynne M. Valente,,9781250816214,9/20/2025,9/20/2025,9/20/2025,4,
Against Empire,Michael Parenti,,9780872862982,12/29/2023,6/28/2023,6/28/2023,4,
How UFOs Conquered the World: The History of a Modern Myth,David Clarke,,9781781313039,4/23/2025,4/23/2025,4/23/2025,4,
Poster Girl,Veronica Roth,,9780358164098,12/28/2023,3/5/2023,3/5/2023,3,
"Cultural Identity and the Purposes of God: A Biblical Theology of Ethnicity, Nationality, and Race",Steven M. Bryan,,9781433569760,2/6/2025,2/5/2025,2/5/2025,4,"<div>Cultural Identity and the Purposes of God by Steven Bryan--Rich with anecdotes and textual analysis of Scripture, this book provides an introduction to a schema of reconciling diversity and faith. The book itself is certainly thought-provoking, but the author interprets some stories in the Bible in a fairly unique way that happens to line up with his book's thesis. To be clear, I'm not contesting the overall message of the book, that cultural Identity and diversity are features of God's plan for humanity as outlined in Scripture, I simply think that occasionally the wrong equations are used to get to the right answer. Color is provided in the author's experiences teaching in Ethiopia for decades and it is clear that he has wrestled with the questions (and answers) raised here. Thumbs up.&nbsp;</div>"
The Farm,Joanne Ramos,,9781984853752,12/29/2023,8/12/2023,8/12/2023,4,
Vessel,Lisa A. Nichols,,9781501168772,12/28/2023,5/5/2023,5/5/2023,3,
Marvel 1602,Neil Gaiman,"Andy Kubert, Richard Isanove, Todd Klein, Peter Sanderson",9780785123118,12/28/2023,5/13/2023,5/13/2023,4,
Colored Television,Danzy Senna,,9780593544396,2/23/2025,2/23/2025,2/23/2025,,
Dark Force Rising,Timothy Zahn,,9780553560718,5/13/2024,5/13/2024,5/13/2024,,
Dreyer's English: An Utterly Correct Guide to Clarity and Style,Benjamin Dreyer,,9780812995701,12/28/2023,1/30/2023,1/30/2023,4,
Fantasticland,Mike Bockoven,,9781510709447,12/29/2023,12/28/2023,12/28/2023,4,
The Caretaker,Marcus Kliewer,,9781982198817,6/4/2026,6/4/2026,6/4/2026,5,
Foolproof: Why Misinformation Infects Our Minds and How to Build Immunity,Sander van der Linden,,9780393881448,12/29/2023,8/7/2023,8/7/2023,4,
How to Win Friends and Influence Enemies: Deliver Winning Conservative Arguments Against Mainstream Media,Will Witt,,9781546000242,12/28/2023,5/20/2023,5/20/2023,1,
Super Pumped: The Battle for Uber,Mike Isaac,,9780393652246,12/29/2023,7/31/2023,7/31/2023,4,
Blob: A Love Story,Maggie Su,,9780063358645,2/10/2025,2/10/2025,2/10/2025,4,
You Are Fatally Invited,Ande Pliego,,9780593871577,9/20/2025,9/20/2025,9/20/2025,4,
Everything is Obvious: Once You Know the Answer,Duncan J. Watts,,,10/31/2024,11/9/2024,11/9/2024,4,"<div>Everything is Obvious by Duncan Watts--This book is refreshing in what it doesn't know. That is, while a lot of different topics get brought up, Watts is refreshing in the way he lays out what we have yet to learn in social sciences. That broad array of topics includes prediction markets, political beliefs in friend groups, data and advertising, and justice when a choice's impact is disproportionately large compared to its in-the-moment evaluation. Throughout, there's a good exploration of biases and patterns that it's easy to fall into. Thumbs up.</div>"
Defending Jacob,William Landay,,9780385344227,12/29/2023,10/2/2023,10/2/2023,4,
Beware of Chicken ,Casualfarmer,,B09Y6RQSHM,1/17/2026,1/17/2026,1/17/2026,3,
Snow Crash,Neal Stephenson,,9780613361620,3/14/2024,,,,
Pickleball For Dummies,"Reine Steel, Diana Landau, Carl Landau, Mo Nard",,9781119895138,12/28/2023,1/15/2023,1/15/2023,4,
The Book of Luke,Lovell Holder,,9781538770153,3/6/2026,3/6/2026,3/6/2026,4,
The House in the Cerulean Sea,TJ Klune,,9781250217325,7/11/2024,7/11/2024,7/11/2024,4,"<div>The House in the Cerulean Sea by TJ Klune--Charming and delightful, the best way I could describe this book to someone who hadn't read it is like an upbeat magical fantasy Series of Unfortunate Events from the perspective of Mr. Poe. I won't spoil much here because the journey is all of the fun, but this is a feel-good book full of precocious children, slow-burn romance (sometimes literally), and a man who's absolutely devoted to rules and regulations. I'm really impressed. Thumbs up.</div>"
City of Rivals: Restoring the Glorious Mess of American Democracy,Jason Grumet,,9780762791583,11/2/2024,11/2/2024,11/2/2024,4,"<div>City of Rivals by Jason Grumet--It feels like a good week to read about nothing being done in DC. This book feels almost adrift in time, written about a decade ago and very much of a different political era. Proposed reforms range from absurdly idealistic to surprisingly practical, getting in the weeds on how Congress could be operating better. With that said, the fact that this book was written before the ousters of folks like Liz Cheney and Kevin McCarthy and before the events of January 6th kind of haunts the pages. It's a specter looking over robust discussion of streamlining Senate confirmation hearings. I don't know how much this book can possibly offer to the political climate of today, but it's well-conceived, even if it defends lobbyists too much for my liking. Thumbs up.</div>"
Mad Honey,"Jennifer Finney Boylan, Jodi Picoult",,9781984818386,12/29/2023,12/29/2023,12/29/2023,5,"<div>This book really got to me. A murder mystery/legal thriller, this book follows a woman whose son, a star athlete, is accused of a brutal murder of his loving girlfriend. The story unfolds from two different perspectives, and is brilliantly done. Often when I've read books from different perspectives, the characters are wholly different, allowing them each to have distinct voices. This book has two very similar protagonists, yet manages to have wholly separate voices throughout. I don't know if I've read a book more filled with empathetic realism than this one, and the story is at a simmer the whole time, always one tablespoon of honey away from an explosion. There's some really masterful stuff being done with time and perspective in this book as well, but elaborating wouldn't bee prudent. Two thumbs up.</div>"
How Not to Be Wrong: The Power of Mathematical Thinking,Jordan Ellenberg,,9781594205224,10/3/2024,10/2/2024,10/2/2024,4,"<div>How Not To Be Wrong by Jordan Ellenberg--About as cozy as a math book can get, this book focuses on logic and how folks think about the world from a mathematical perspective. He looks at baseball, the lottery, replicability in experiments, whether or not God exists, Antonin Scalia, and more. Good book, easy to understand, no complaints. Thumbs up.</div>"
Meme Wars: The Untold Story of the Online Battles Upending Democracy in America,"Brian Friedberg, Emily Dreyfuss, Joan Donovan",,9781635578638,12/28/2023,2/3/2023,2/3/2023,5,
Utopia for Realists: How We Can Build the Ideal World,Rutger Bregman,,9780316471916,2/14/2024,2/13/2024,2/13/2024,4,"<div>Utopia for Realists by Rutger Bregman--This book is small and packs a punch. Bregman makes a convincing argument in favor of a shorter workweek, universal basic income, and more, all in favor of a scientifically-supported utopia. I think he makes compelling arguments, however, it's where he advocates for wholly open borders that he starts to lose me. He brushes past arguments against open borders, and his explanation about the economic impacts runs starkly counter to his own arguments in favor of UBI. With that said, it's a pragmatic look at the 21st century and the future of work (hopefully?). Thumbs up.</div>"
Team of Rivals: The Political Genius of Abraham Lincoln,Doris Kearns Goodwin,,9780743270755,2/24/2025,2/24/2025,2/24/2025,,
"Red Pill, Blue Pill: How to Counteract the Conspiracy Theories That Are Killing Us",David Neiwert,,9781633886261,12/29/2023,6/2/2023,6/2/2023,4,
The Trading Game,Gary Stevenson,,9780593727218,6/7/2025,6/7/2025,6/7/2025,4,"<div>The Trading Game by Gary Stevenson--This is written quite well. Stevenson was a successful trader in the wake of the financial crisis and claims to have made his substantial wealth at Citibank by betting on growing inequality post-crisis. More interesting than his trading strategy, however, is the personalities in the trading pit, brought to life by surprisingly rich prose. This really is a dark book. I had to take a break at one point just processing what was going on. The people are dreadful to each other, author included. Stevenson effectively skewers the industry he grew his wealth in, while at the end, advocating for a better future. It's a haunting read. Thumbs up.</div>"
Freakonomics: A Rogue Economist Explores the Hidden Side of Everything,"Steven D. Levitt, Stephen J. Dubner",,9780060731328,5/7/2024,,,,
The Janus Point: A New Theory of Time,Julian Barbour,,9781473548862,1/28/2024,1/28/2024,1/28/2024,4,"<div>The Janus Point by Julian Barbour--In-depth and novel, this book proposes a somewhat new theory of the universe's origin and, indeed, of time itself. The book is relatively simple to follow and isn't pedantic. Barbour also completes a comprehensive evaluation of the history of scientific dialogue around his area of expertise. Thumbs up.&nbsp;</div>"
The Minders,John Marrs,,9781473572201,12/28/2023,5/7/2023,5/7/2023,4,
Dead Sea Rising,Jerry B. Jenkins,Craig A. Evans,9781617950094,9/13/2025,9/13/2025,9/13/2025,2,
The Martian,Andy Weir,,9780804139021,5/26/2025,5/25/2025,5/25/2025,4,
Dead Sea Conspiracy,Jerry B. Jenkins,,9781546014225,9/14/2025,9/14/2025,9/14/2025,2,
One Perfect Couple,Ruth Ware,,9781668025598,9/14/2024,9/13/2024,9/13/2024,4,"<div>One Perfect Couple by Ruth Ware--It's Agatha Christie for the era of reality TV. A couple in a long-term relationship sign up for a dating competition against other couples where folks will be eliminated one at a time. The story proceeds in a very fun way, with a reveal I didn't see coming. Death and secrets and romance abound in this book that's a fun satire of the reality TV phenomenon. Thumbs up.</div>"
The Offset,Calder Szewczak,,9780857669186,5/15/2024,,,3,"<div>The Offset by Natasha Calder and Emma Szewczak--Dystopia with little redeeming it, this book follows a series of relatively unlikable characters living in the age of the Offset, where anyone who chooses to have a child must face the consequences when the child turns 18--the child must choose a parent to die in a public execution. I'm not sure the unexpected twist in this story does enough to save the book. I'm not overly impressed, but I can imagine some folks who might like the book. Sideways thumb.</div>"
The Water Cure,Sophie Mackintosh,,9780385543873,5/7/2025,5/7/2025,5/7/2025,4,
Truth of the Divine,Lindsay Ellis,,9781250274540,12/29/2023,8/21/2023,8/21/2023,4,
Starter Villain,John Scalzi,,9780765389220,12/29/2023,10/9/2023,10/9/2023,4,
Babel,R.F. Kuang,,9780008501815,10/15/2024,10/15/2024,10/15/2024,5,"<div>Babel by R. F. Kuang--I have been postponing this for far too long. This story blends a surprisingly artful metaphor for empire with full, rich characters and a world that is real and gritty and messy. This is a speculative fiction work that follows a young man attending Oxford as a novice translator in a world where translation powers everything. Kuang takes time to flesh out and truly reckon with the consequences of the world she's built while making it feel grounded in moments of pure delight and heartbreak. I felt like I had a gut punch while I was deplaning and came to a particular part of the story that I won't soon forget. I do not think everyone should read this book, but everyone who wants to read it should read it immediately. Two thumbs up.</div>"
Wake Up and Open Your Eyes,Clay McLeod Chapman,,9781683693956,4/20/2025,4/19/2025,4/19/2025,3,
System Change,SunriseCV,,B0B61RJ929,1/17/2026,1/17/2026,1/17/2026,4,
The Myth of Persecution: How Early Christians Invented a Story of Martyrdom,Candida Moss,,9780062104526,2/21/2025,2/20/2025,2/20/2025,4,"<div>The Myth of Persecution by Candida Moss--Exhaustively researched and surprisingly nuanced, this book explores the history of persecution in the early church. Moss visits the early Christian church as it begins to develop its own mythology, from beleaguered saints to the glorification of martyrs. Artificial martyrdom and the exaggeration of persecution certainly have parallels to the modern day, and Moss makes the argument that the American church's obsession with Christianity being persecuted ends up drawing well-deserved attention from actual atrocities globally. Thumbs up.</div>"
Empireland,Sathnam Sanghera,Marlon James (Contributor),9780241445297,12/28/2023,5/5/2023,5/5/2023,4,
The Twist of a Knife,Anthony Horowitz,,9781529124330,12/28/2023,1/26/2023,1/26/2023,4,
America's Deadliest Election: The Cautionary Tale of the Most Violent Election in American History,Dana Bash,,9781335081070,11/30/2024,11/30/2024,11/30/2024,4,"<div>America's Deadliest Election by Dana Bash--I didn't come into this book expecting much, but was left surprised by this fascinating and likely little-known story. It details the 1872 gubernatorial election in Louisiana and the personalities behind it which spurred violence, tax strikes, and discontent. The parallels to the modern day are clear, particularly in the legal battles where one potential governor almost-but-not-quite directly ordered murders and enacted his own rules in pursuit of his own political aims. It's both a sobering and deeply impactful read, particularly in its analysis of the outcomes which still resonate today. Thumbs up.</div>"
Bible Nation: The United States of Hobby Lobby,"Joel S. Baden, Candida R. Moss",,9780691177359,11/29/2024,11/28/2024,11/28/2024,4,"<div>Bible Nation by Candida Moss and Joel Baden--Certainly physically close to home for me, if nothing else, this book reviews the Green family, the billionaires who founded and run Hobby Lobby. The book dives deep into the Greens' attempts to influence Oklahoma education on the Bible as well as broader scholarship on the origins of Scripture. While it's a solid book, it's a little frustrating that the Museum of the Bible is a centerpiece of the narrative yet the authors did not visit the Museum until after the book was written and was in preproduction. It feels like the authors were pressed to a deadline that it wasn't reasonable for them to reach. However, the book is informative. Thumbs up.</div>"
Data and Goliath: The Hidden Battles to Collect Your Data and Control Your World,Bruce Schneier,,9780393352177,3/25/2024,3/25/2024,3/25/2024,4,"<div>Data and Goliath by Bruce Schneier--Schneier quickly and adeptly dives into the data we leak out every day and the corporate and government vacuums that suck it all up for their own purposes. This is the most strident that I've seen Schneier write, he sees data privacy as the singular issue we are failing at, with what he views as potentially catastrophic consequences. The reforms he proposed are similarly revolutionary (and likely so far out of reach as to be classified as fantasy). He wants, for example, the NSA to disclose zero-day exploits it identifies rather than exploiting them for their own purposes. It's a well-meaning, but ultimately sad book. Thumbs up.</div>"
The Swap,Robyn Harding,,9781982141769,6/3/2026,6/3/2026,6/3/2026,4,
Feedback,Dennis E. Taylor,,,2/12/2026,2/12/2026,2/12/2026,,
Unruly: A History of England's Kings and Queens,David Mitchell,,9781405953177,1/21/2025,1/20/2025,1/20/2025,4,"<div>Unruly by David Mitchell--What a delight. This primer on British royalty is written in Mitchell's signature comedic voice and is a quick and dirty (often dirty) look at the kings and queens of Britain. From children manipulated to govern to queens that get unfairly maligned, this book really has it all. Thumbs up.</div>"
Norwegian Wood,Haruki Murakami,Jay Rubin (Translator),9780375704024,12/28/2023,3/16/2023,3/16/2023,3,
Cell,Robin Cook,,,12/28/2023,3/4/2023,3/4/2023,2,
The Constant Rabbit,Jasper Fforde,,9781444763621,12/28/2023,4/25/2023,4/25/2023,4,
Lives of the Stoics: The Art of Living from Zeno to Marcus Aurelius,"Stephen Hanselman, Ryan Holiday",,9780525541875,12/29/2023,7/27/2023,7/27/2023,4,
MoneyGPT: AI and the Threat to the Global Economy,James Rickards,,9780593718636,12/7/2025,12/6/2025,12/6/2025,2,
The Austere Academy,Lemony Snicket,"Michael Kupperman (Illustrator), Brett Helquist (Illustrator)",9780064408639,12/29/2023,5/25/2023,5/25/2023,4,
Reboot,Justin Taylor,,9780553387629,1/8/2025,1/7/2025,1/7/2025,4,"<div>Reboot by Justin Taylor--Surreal and hilarious, this book dives deep (sometimes too deep) into fan culture in service of this story about a cult favorite show that might be getting a reboot. The story is extremely online, sometimes in ways that are uncomfortably close to home.&nbsp; The ride is a blast, and the book is more insightful than I would have expected. Thumbs up.</div>"
The Paradox Hotel,Rob Hart,,9781984820648,12/29/2023,8/3/2023,8/3/2023,4,
The Tenant,Freida McFadden,,9781464238819,2/25/2026,2/24/2026,2/24/2026,2,"<div>The Tenant by Frieda McFadden--i think this book most clearly demonstrated weaknesses in McFadden's writing. In addition to being fairly predictable for a thriller, this is the first book of hers that I've read written from a man's perspective. The man is extremely poorly written, in a way not all that dissimilar from some critiques of male authors writing characters who are women. I didn't love this and honestly it was a bit of a struggle to finish. Thumbs down.&nbsp;</div>"
Dominion,Addie E. Citchens,,9780374609337,10/8/2025,10/8/2025,10/8/2025,4,
The Electric Kingdom,David Arnold,,9780593202227,5/27/2026,5/27/2026,5/27/2026,4,
Mindhunter: Inside the FBI's Elite Serial Crime Unit,John E. Douglas,Mark Olshaker,9780671528904,12/29/2023,11/23/2023,11/23/2023,4,
The Grace Year,Kim Liggett,,9781250145444,12/29/2023,7/25/2023,7/25/2023,4,
Batman: The Long Halloween,Jeph Loeb,"Tim Sale, Gregory Wright, Richard Starkings",9781563894695,12/29/2023,9/11/2023,9/11/2023,4,
Deep Utopia: Life and Meaning in a Solved World,Nick Bostrom,,9781646871643,12/9/2025,12/8/2025,12/8/2025,5,
Sapiens: A Brief History of Humankind,Yuval Noah Harari,,9780062316097,7/10/2024,,,,
Chip War: The Fight for the World's Most Critical Technology,Chris Miller,,9781982172008,12/29/2023,11/13/2023,11/13/2023,4,
"Raw Deal: Hidden Corruption, Corporate Greed, and the Fight for the Future of Meat",Chloe Sorvino,,9781982172046,12/29/2023,10/11/2023,10/11/2023,4,
Ninth House,Leigh Bardugo,,9781250313072,11/9/2024,11/8/2024,11/8/2024,2,
The Silence Project,Carole Hailey,,9781838956073,5/15/2024,6/8/2024,6/8/2024,5,"<div>The Silence Project by Carole Hailey--I have some mixed feelings about this book. It was a StoryGraph recommendation, which continue to be very solid, and as it's a UK published book, I had trouble finding it anywhere in the US, eventually getting it from Amazon. The book is, among other things, a commentary on misogyny and class, a veiled critique of Margaret Sanger (founder of Planned Parenthood), and an examination of a corrupted purpose, that is, what do you do when your life's work turns out to not accomplish the mission you thought it did. The book is piercing and incisive, written from the perspective of a woman whose mother starts a movement that fundamentally reshapes the world. It's somewhat similar to books like Vox (Christina Dalcher), The Power (Naomi Alderman), and The Grace Year (Kim Liggett), but feels more grounded than the others in a really powerful way. Two thumbs up.</div>"
The Ministry for the Future,Kim Stanley Robinson,,9780316300131,3/30/2024,3/30/2024,3/30/2024,5,"<div>The Ministry For The Future by Kim Stanley Robinson--Methodically pragmatic yet unwavering in its optimism, this work of fiction could be ripped from tomorrow's headlines. While the story it tracks is extremely close to home, it's clear that the author did immense research to make this book a reality. The narrative follows a hypothetical Ministry for the Future under the United Nations, but the interstitials which break up the story give it strength, as the author and other characters ponder what this all means for us in the current moment. In some ways, it really is a beautiful book, it's clear the author intends the story to be nonfiction as fiction. Two thumbs up.</div>"
The Free People's Village,Sim Kern,,9781646142668,12/29/2023,10/10/2023,10/10/2023,4,
We the People: A History of the U.S. Constitution,Jill Lepore,,9781631496080,10/9/2025,10/9/2025,10/9/2025,4,
Satan's Diary,Nicholas Ponticello,,9798989438051,6/6/2025,6/6/2025,6/6/2025,3,"<div>Satan's Diary by Nicholas Ponticello--There are areas of excellence in this book. The author fleshes out the characters in this retelling of Satan's ""fall"" in a way that is compelling and worth visiting. However, some of the story decisions can be baffling. When you're jumping forward for broad swaths of time in human history, the places you do step in need to be justified. With that said, this can be compared to books like Song of Achilles in that it tries to recontextualize a well known historical relationship between God and Satan. In that aim, I think the book partially succeeds, though I don't think it sticks the landing. The book's summary talks about angels with iPads and bringing a modern spin to a heavenly story. The story provides that...in the epilogue. I don't think it lived up to my expectations, though there are some touching parts. I received an advance review copy of the book, and if you want to see how much you agree with my analysis, check it out when it's published in July. Sideways thumbs.&nbsp;</div>"
Dept. of Speculation,Jenny Offill,,9780385350815,6/24/2025,6/24/2025,6/24/2025,4,
