Title,Authors,Contributors,ISBN/UID,Date Added,Last Date Read,Dates Read,Star Rating,Review
The Inner Clock: Living in Sync with Our Circadian Rhythms,Lynne Peeples,,593538927,1/27/2025,1/27/2025,1/27/2025,4,"<div>The Inner Clock by Lynne Peeples--Both a history of our relationship with sleep and an analysis of the science behind it, this book is fascinating. Everything from window shape to breastfeeding to time of medicine ingestion is fair game in this wide-sprawling review, and the stories inside are riveting. I enjoyed some of the meta-analysis of studies on sleep and performance across a variety of metrics. Thumbs up.</div>"
The Genius Plague,David Walton,,9781633883437,12/28/2023,1/24/2023,1/24/2023,4,
Zero Days,Ruth Ware,,9781982155315,7/30/2024,8/6/2024,8/6/2024,4,"<div>Zero Days by Ruth Ware--This book feels desperately frantic. Ware does a great job of starting off with raised stakes that continue until the very end. As a reader, you almost breathe a sigh of relief when the book concludes. A psychological thriller, the story focuses on a security/penetration tester who works in tandem with her husband until circumstances have her gallivanting around the UK to solve a murder. This was maybe Ware's most predictable book I've read, the story and endgame was pretty clear about a third of the way in. But even knowing what's ahead, the ride is superb. It's a tech-forward book that's still immensely accessible. Thumbs up.</div>"
Quantum Night,Robert J. Sawyer,,9780425256831,8/2/2024,8/2/2024,8/2/2024,4,"<div>Quantum Night by Robert J. Sawyer--I mean, this is quantum mechanics meets an in-depth exploration of ethics, all framed in some ludicrous plot devices that somehow still hit way too close to home. Of course I loved this. The book follows an applied philosophy professor who gets the chance to, erm, apply some philosophy when he discovers a nearly two decade old memory gap. The plotting for this story is bananas, but it's a fun read. Thumbs up.</div>"
"Hype: How Scammers, Grifters, and Con Artists Are Taking Over the Internet--And Why We're Following",Gabrielle Bluestone,,9781335016492,12/28/2023,1/3/2023,2023/01/03-2023/01/03,,
Gregor and the Code of Claw,Suzanne Collins,,9780439791434,12/29/2023,6/24/2023,6/24/2023,4,
What Would Gen-Z Do?: Everything You Don't Know about Gen-Z But Should,John Schlimm,,9781641707367,12/28/2023,1/26/2023,1/26/2023,1,
The House of Quiet,Kiersten White,,9780593806586,7/9/2026,7/8/2026,7/8/2026,4,
Wild Dark Shore,Charlotte McConaghy,,9781250827951,1/24/2026,1/24/2026,1/24/2026,5,"<div>Wild Dark Shore by Charlotte McConaghy--Vivid, with language that leaps off the page and into your soul, this book is both thriller and scientific exploration. The story is simple, a woman arrives on an isolated island which will soon be consumed by rising water. The story itself is well-constructed, undergirded by words that are in turns soaring and despairing. I'll be thinking about this for awhile. Two thumbs up.&nbsp;</div>"
Bad Blood: Secrets and Lies in a Silicon Valley Startup,John Carreyrou,,9781524731656,9/2/2025,,,,
The Last Days of Jack Sparks,Jason Arnopp,,9780356507187,12/2/2025,12/2/2025,12/2/2025,4,
Who Knows You by Heart,C.J. Farley,,9780063418639,12/20/2025,12/20/2025,12/20/2025,4,"<div>Who Knows You By Heart by C. J. Farley--The second-person perspective in this book is certainly jarring, but rewarding. Farley's thumb is on the pulse of Big Tech here while simultaneously being full of nearly absurd hope. You'll love the singular point of view of the protagonist and the surprisingly earnest responses to near-atrocities from the largest companies (oligarchy?) you already depend on. You take this book in as a story of stories encapsulating a lot of big ideas, including a serious contemplation of where you go from here. Thumbs up.&nbsp;</div>"
"River of the Gods: Genius, Courage, and Betrayal in the Search for the Source of the Nile",Candice Millard,,9780385543101,12/28/2023,1/31/2023,1/31/2023,4,
"Being Online: On Computing, Data, the Internet, and the Cloud",Jian Wang,,9781951627799,12/28/2023,2/9/2023,2/9/2023,4,
Broken Signposts: How Christianity Makes Sense of the World,N.T. Wright,,9780062564092,12/29/2023,7/24/2023,7/24/2023,3,
Polostan,Neal Stephenson,,9780062334497,12/10/2024,12/10/2024,12/10/2024,4,"<div>Polostan by Neal Stephenson--This is a very solid start to what promises to be an epic trilogy. It's historical fiction, set primarily in the 1920s and 30s in the United States. I really enjoyed the story and the characters (particularly the protagonist), who still remain somewhat of an enigma. There's a lot of depth to the narrative, and I'm excited to see what comes next. Thumbs up.</div>"
Charlotte's Web,E.B. White,Garth Williams (Illustrator),9780061124952,9/2/2025,,,,
All the Secrets of the World,Steve Almond,,9781638930020,12/28/2023,2/13/2023,2/13/2023,4,
Future Home of the Living God,Louise Erdrich,,9780062694058,12/23/2025,12/23/2025,12/23/2025,4,
The Locked Door,Freida McFadden,,B092RXXJDM,2/5/2026,2/4/2026,2/4/2026,4,
"The Biggest Ideas in the Universe 1: Space, Time and Motion",Sean Carroll,,9780861542888,12/28/2023,4/20/2023,4/20/2023,4,
"Anatomy of a Con Artist: The 14 Red Flags to Spot Scammers, Grifters, and Thieves",Johnathan Walton,,9780593797167,10/17/2025,10/17/2025,10/17/2025,4,
Loki,Melvin Burgess,,9781399701525,12/29/2023,12/23/2023,12/23/2023,4,
"Dead in Long Beach, California",Venita Blackburn,,9780374602826,1/3/2025,1/2/2025,1/2/2025,4,"<div>Dead In Long Beach, California by Venita Blackburn--I was not sold on the idea of this book initially. As I got further in, however, the story was at turns poignant, then hilarious, then deep. With one foot in the past and one foot in the future, Blackburn turns a real wallowing in grief into something greater, and the end result is a book that's fundamentally weird but delightful. Thumbs up.</div>"
Daedalus Is Dead,Seamus Sullivan,,1250370477,12/22/2025,,,4,"<div>Via a series of quick vignettes, this book explores the life (and death) of Daedalus from beginning to end. It's touching in its approach and succeeds in drawing the reader in.&nbsp;</div>"
Lying in State: Why Presidents Lie -- And Why Trump Is Worse,Eric Alterman,,9781541616820,12/28/2023,5/18/2023,5/18/2023,3,
The Fury,Alex Michaelides,,9781250758989,5/15/2024,5/19/2024,5/19/2024,5,"<div>The Fury by Alex Michaelides--I thought Michaelides' The Maidens was a little lacking after loving his Silent Patient, this book puts him right back into the mix. The beginning of the plot comes straight from a Knives Out movie: an eccentric star takes her friends to her private Greek island. From there, however, the story turns to a character-focused drama, led first and foremost by the narrator, a burgeoning playwright. The story skillfully weaves from point to point like a sailor navigating the fierce winds around the Greek isles, leaving no stone unturned in a relentless march toward a conclusion which, in retrospect, seems obvious. Two thumbs up.</div>"
The Library: A Catalogue of Wonders,Stuart Kells,,9781925355994,12/28/2023,1/19/2023,1/19/2023,4,
The Woman in Cabin 10,Ruth Ware,,9781501132933,3/28/2024,3/27/2024,3/27/2024,5,"<div>The Woman in Cabin 10 by Ruth Ware--I can't stop raving about Ware. Every book I've read by her has been phenomenal, and this was no exception. This was a more straightforward murder mystery than I've previously seen of hers, and it's impeccably crafted. The story is riveting, and it's backed up by an ongoing ticking clock. Even though Ware doesn't include her typical atmospheric dread, the pacing is relentless and the party don't stop until the very last page. Two thumbs up.</div>"
The Checklist Manifesto: How to Get Things Right,Atul Gawande,,9780805091748,1/16/2025,1/16/2025,1/16/2025,4,"<div>The Checklist Manifesto by Atul Gawande--Truly I cannot think of two works by the same author that hit such different notes tonally. Being Mortal by Gawande was an emotionally resonant book about aging and the ways we as a society and medical profession fail the oldest among us. This book, by contrast, is a manual for the private sector masquerading as a more general self-help book. That's not to say that it's not worthwhile, the anecdotes, largely from the medical and airline industries, demonstrate the author's idea that well-designed checklists save lives. Maybe I need to be less haphazard when packing for work trips. Thumbs up.</div>"
The Golden Spoon,Jessa Maxwell,,9781668008003,11/21/2025,11/21/2025,11/21/2025,4,
The Rational Optimist: How Prosperity Evolves,Matt Ridley,,9780061452055,12/28/2023,4/5/2023,4/5/2023,2,
My Murder,Katie Williams,,9780593543788,12/31/2023,12/31/2023,12/31/2023,4,"<div>Thrilling yet contemplative, this book imagines a world where cloning exists for people who have died whom society has an interest in bringing back. The protagonist, a woman recently murdered by a prolific serial killer, is one of these clones, and must solve her own murder. This book is really only one small part murder mystery, however, and gives a much more in-depth focus to the things that drive us. When we've literally lost everything and gained it back, how do we cope with that? It's a solid, inventive book. Thumbs up.&nbsp;</div>"
The Parade,Dave Eggers,,9780735277526,5/24/2025,5/24/2025,5/24/2025,4,
"The Art of Language Invention: From Horse-Lords to Dark Elves, the Words Behind World-Building",David J. Peterson,,9780143126461,1/12/2025,1/12/2025,1/12/2025,4,"<div>The Art of Language Invention by David Peterson--Language invention is wild. This book dives extremely deep into constructed languages. I've never thought so much about glottal sounds and the alveolar sounds that make up the ways we communicate. The material is thorough, and if you want a primer on everything to consider in making your own language, this is the book for you. Thumbs up.</div>"
Still Christian: Following Jesus Out of American Evangelicalism,David P. Gushee,,9780664263379,7/3/2026,7/3/2026,7/3/2026,4,
The Awoken,Katelyn Monroe Howes,,9780593185285,12/28/2023,4/22/2023,4/22/2023,4,
Discount Dan,James A. Hunter,,,1/25/2026,1/25/2026,1/25/2026,4,
After Evangelicalism: The Path to a New Christianity,David P. Gushee,,9780664266110,7/2/2026,7/2/2026,7/2/2026,4,
The Maid,Nita Prose,,9780593356159,12/29/2023,8/22/2023,8/22/2023,4,
"All Jobs and Classes! I Just Wanted One Skill, Not Them All! (LITRPG/EPIC PROGRESSION):",,,,2/26/2026,2/26/2026,2/26/2026,4,
Little Eyes,Samanta Schweblin,Megan McDowell (Translator),9780525541363,1/31/2026,1/31/2026,1/31/2026,4,
Goliath’s Curse: The History and Future of Societal Collapse,Luke Kemp,,9780593321355,11/16/2025,11/16/2025,11/16/2025,4,
Boldly Go: Reflections on a Life of Awe and Wonder,William Shatner,Joshua Brandon,9781668007327,12/29/2023,9/19/2023,9/19/2023,4,
Thinking Inside the Box: Adventures with Crosswords and the Puzzling People Who Can't Live Without Them,Adrienne Raphel,,9780525522089,12/28/2023,1/3/2023,2023/01/03-2023/01/03,,
Sherlock Holmes & The Three Winter Terrors,James Lovegrove,,B08QMVRPLN,6/25/2025,6/25/2025,6/25/2025,4,
Dead Money,Jakob Kerr,,9780593726709,6/24/2025,6/23/2025,6/23/2025,4,
Wool,Hugh Howey,,9781780891248,12/28/2023,3/11/2023,3/11/2023,4,
Daisy Darker,Alice Feeney,,9781529089806,9/2/2025,,,,
Unwind,Neal Shusterman,,9781416912040,12/29/2023,5/29/2023,5/29/2023,4,
"How the World Made the West: A 4,000-Year History",Josephine Quinn,,9780593729793,11/25/2024,11/25/2024,11/25/2024,4,"<div>How the World Made the West by Josephine Quinn--A surprisingly comprehensive examination of world history, this book has a lofty goal: demonstrate that the origins of ""the West"" are far more murky than then Minoans, Myceneans, and Greco-Roman ties we've been taught. Quinn does this through a fascinating overview of Indian literature, Babylonian law codes, and Phoenician artifacts, alongside accounts from the Greeks and Romans themselves acknowledging their culture was (of course) one step of many in the human experience. It's a delightful book. Thumbs up.</div>"
The Atlas,Rob M. Lastrel,,B0DG9BNST4,1/20/2026,1/20/2026,1/20/2026,4,
Preparing for War: The Extremist History of White Christian Nationalism--and What Comes Next,Bradley Onishi,,9781506482163,5/9/2024,5/8/2024,5/8/2024,4,"<div>Preparing for War by Bradley Onishi--This book cuts deep. It's an examination of White Christian nationalism found throughout American evangelicalism both from a historical lens and from the personal experiences of the author. Onishi details a layered, broad-spanning movement rooted in a simultaneous terrified fear of losing worldly power with an unshakeable sense of entitlement to that power among the evangelical Right/White. Onishi powerfully ties the bow on the story with the culmination of January 6 and his own analysis of what's to come. This book is worth the read. Thumbs up.</div>"
"The Wager: A Tale of Shipwreck, Mutiny, and Murder",David Grann,,9780385534260,12/29/2023,8/7/2023,8/7/2023,4,
Dark Places,Gillian Flynn,,9780307341563,12/29/2023,6/8/2023,6/8/2023,2,
"Your Consent Is Not Required: The Rise in Psychiatric Detentions, Forced Treatment, and Abusive Guardianships",Rob Wipond,,9781637741481,12/28/2023,4/3/2023,4/3/2023,4,
Vicious,V.E. Schwab,,9781466822177,12/10/2024,12/9/2024,12/9/2024,4,"<div>Vicious by V.E. Schwab--Oddly sentimental in parts, this book takes place in a very bloody universe where superheroes operate mostly in the shadows, wreaking havoc on the world. The crux of the story focuses on college roommates who discover their new powers and take wildly divergent paths. This is a dark story with a lot of power. Thumbs up.</div>"
"My Ex, the Antichrist",Craig DiLouie,,9780316578189,8/23/2025,8/22/2025,8/22/2025,4,
Infinity Gate,M.R. Carey,,9780316504386,8/18/2025,8/18/2025,8/18/2025,5,
When the Moon Hits Your Eye,John Scalzi,,9780765389091,4/17/2025,4/17/2025,4/17/2025,4,
"The Rise and Reign of the Mammals: A New History, from the Shadow of the Dinosaurs to Us",Steve Brusatte,,9780062951519,7/2/2026,7/1/2026,7/1/2026,4,
Theodore Roosevelt for the Defense: The Courtroom Battle to Save His Legacy,"Dan Abrams, David Fisher",,9781335016447,1/25/2026,1/24/2026,1/24/2026,4,
Into the Black Nowhere,Meg Gardiner,,9781101985557,1/6/2026,1/6/2026,1/6/2026,4,
Through Adversity,Alexander Wales,,,1/13/2026,1/12/2026,1/12/2026,4,
Hedge Hogging,Barton Biggs,,9780471771913,11/30/2025,11/30/2025,11/30/2025,3,
The Three Monarchs,Anthony Horowitz,,9780062387844,6/7/2025,6/7/2025,6/7/2025,4,
Right Kind of Wrong: The Science of Failing Well,Amy C. Edmondson,,9781982195069,10/5/2024,10/5/2024,10/5/2024,4,"<div>Right Kind of Wrong by Amy Edmondson--It's tough for me to imagine the person or group this wouldn't be helpful for. With a solid blend of scientific data and demonstrative anecdotes, this book addresses failure from multiple points of view--group/system, individual, and societal. It truly is chock-full of good information, much of which gets glazed over on the rush to the next insight. This is a good place to land for a thoughtful primer on what failure is and how best to think about it. Thumbs up.</div>"
Kill Switch: The Rise of the Modern Senate and the Crippling of American Democracy,Adam Jentleson,,9781631497780,12/28/2023,3/25/2023,3/25/2023,4,
The Dark Forest,Cixin Liu,Joel Martinsen (Translator),9781784971601,12/28/2023,4/26/2024,"2024/04/26, 2023/03/03",5,
Where They Wait,Scott Carson,,9781982104627,10/22/2024,10/22/2024,10/22/2024,4,"<div>Where They Wait by Scott Carson--Mindbending and strange, this book follows a meditation app gone wrong. When a journalist learns about a novel calmness app that's making waves, he soon gets sucked in. This is dark and twisty, I really had fun reading it. Thumbs up.</div>"
Technofeudalism: What Killed Capitalism,Yanis Varoufakis,,9781847927279,9/28/2025,9/28/2025,9/28/2025,4,
Mother Knows Best: A Novel,Kira Peikoff,,9781643850405,7/9/2026,7/9/2026,7/9/2026,4,
"The Cult of We: Wework, Adam Neumann, and the Great Startup Delusion","Eliot Brown, Maureen Farrell",,9780593237113,7/15/2024,7/14/2024,7/14/2024,4,"<div>The Cult of We by Eliot Brown--Y'know, as someone who works for an agency that's been targeted by Wall Street Journal reports lately, there's some schadenfreude present in reading this charting of the rise and fall of WeWork. This book repackages and expands on WSJ reporting with some really jaw-dropping stuff. Ultimately, this was a story of hubris and self-dealing, with a surprising amount of messianic tendencies. Thumbs up.</div>"
The Troop,Nick Cutter,,9781476717715,10/5/2025,10/5/2025,10/5/2025,4,
Blue Mars,Kim Stanley Robinson,,9780553573350,9/6/2025,9/6/2025,9/6/2025,4,
Everyday Utopia,Kristen R. Ghodsee,,9781982190231,1/19/2025,1/19/2025,1/19/2025,4,"<div>Everyday Utopia by Kristen Ghodsee--This is a fun, thought-provoking book about our ever-so-human attempts to create utopia and our ever-so-human failures at every turn. Ghodsee reviews two thousand years of communes, collaborative schools, rural and urban experiments, all trying to get at a ""better"" way of living. While the book is well-researched, much time is spent amplifying the successes of these experiments when it's possible a more edifying book would detail why these attempts didn't work out. Ghodsee is sometimes militantly evangelical in her approach, and she appears convinced that the glorification of the family unit is the primary thing that keeps us one step away from utopia. To that end, she brings up philosophers, revolutionaries, and, yes, cult leaders who have also decried the family unit. I think there's certainly something to what she's saying--what does it mean for the American political system to be focused on winning ""middle class/working class families"" (even if only in word, not in deed) rather than uplifting everyone through a communal approach? For me, though, I think this book convinced me that a society-level communal utopia isn't possible to strive for. Put another way, maybe the real utopia is the friends we made along the way. Thumbs up.</div>"
Never Lie,Freida McFadden,,9798352831533,2/6/2026,2/5/2026,2/5/2026,4,
The Loop: How Technology Is Creating a World Without Choices and How to Fight Back,Jacob Ward,,9780316487207,12/28/2023,1/19/2023,1/19/2023,4,
Merchants of Doubt: How a Handful of Scientists Obscured the Truth on Issues from Tobacco Smoke to Global Warming,"Naomi Oreskes, Erik M. Conway",,9781596916104,12/28/2023,1/30/2023,1/30/2023,4,
Persepolis Rising,James S.A. Corey,,9780316332828,8/31/2024,8/31/2024,8/31/2024,,
We Are Legion (We Are Bob),Dennis E. Taylor,,B01LWAESYQ,1/14/2026,1/14/2026,1/14/2026,4,
The Examiner,Janice Hallett,,9781800810457,2/4/2025,2/3/2025,2/3/2025,4,"<div>The Examiner by Janice Hallett--I saw this book on a trip to the bookstore to see my good friend who is an author and a bookstore employee. His books are great, and so is this book. The story plunges you into the position of an independent grade reviewer who is poring through messages and assignments submitted for an art class. There's an alleged death and a twist that I was delighted by, and the message fragments, class schedules, and notes make the book immersive and very fun. Thumbs up.</div>"
"Revenge of the Tipping Point: Overstories, Superspreaders, and the Rise of Social Engineering",Malcolm Gladwell,,9780316575805,12/13/2024,12/12/2024,12/12/2024,3,"<div>Revenge of the Tipping Point by Malcolm Gladwell--I came in optimistic that this would be a full-throated defense of tipping culture, and was excited to learn more. Instead I got something best described as some interesting ideas thrown in a microwave and lazily stirred together, served up without a thesis and a garnish. The book lives or dies on telling a cohesive story, it's a book about the idea of overarching metanarratives, after all. And in this case, it dies. Fine anecdotes, bad book. Sideways thumb.</div>"
Hole in the Sky,Daniel H. Wilson,,9780385551113,1/10/2026,1/10/2026,1/10/2026,4,
The Windup Girl,Paolo Bacigalupi,,9781597801577,12/28/2023,4/7/2023,4/7/2023,4,
The Design of Everyday Things,Donald A. Norman,,9780465067107,12/29/2023,8/4/2023,8/4/2023,4,
The Gospel of J. Edgar Hoover: How the FBI Aided and Abetted the Rise of White Christian Nationalism,Lerone A Martin,,9780691175119,12/28/2023,2/20/2023,2/20/2023,4,
All Better Now,Neal Shusterman,,9781534432758,6/9/2025,6/8/2025,6/8/2025,4,
Five Days at Memorial: Life and Death in a Storm-Ravaged Hospital,Sheri Fink,,307718964,12/28/2023,1/30/2023,1/30/2023,5,
The God Who Is There,"Francis A. Schaeffer, James W. Sire",,,12/30/2025,12/29/2025,12/29/2025,4,
Brother,Ania Ahlborn,,9781476783734,2/23/2025,2/23/2025,2/23/2025,4,
Alpha and Omega,Harry Turtledove,,,3/30/2025,3/30/2025,3/30/2025,3,
Empire of Imagination: Gary Gygax and the Birth of Dungeons & Dragons,Michael Witwer,,9781632862792,12/28/2023,1/12/2023,1/12/2023,,
FORWARD: Notes on the Future of Our Democracy,Andrew Yang,,9780593238653,12/28/2023,3/29/2023,3/29/2023,4,
How Do I Tax Thee?: A Field Guide to the Great American Rip-Off,Kristin Tate,,9781250169662,12/29/2023,7/9/2023,7/9/2023,1,
"Unmask Alice: LSD, Satanic Panic, and the Imposter Behind the World's Most Notorious Diaries",Rick Emerson,,9781637740422,1/29/2024,1/28/2024,1/28/2024,4,"<div>Unmask Alice by Rick Emerson--Enthralling and emotional, Emerson explores the Satanic panic through the lens of a woman who duped the world into believing what they already wanted to believe. Beatrice Sparks claimed to have edited the diary of a girl struggling with drug addiction, turning the adaptation into a book called Go Ask Alice, but as Emerson demonstrates, that book and much of her subsequent success was fabricated from whole cloth. It's a wild book, dealing with drug abuse, the Satanic panic, suicide, and law enforcement. Thumbs up.&nbsp;</div>"
So Happy Together,Olivia Worley,,9781250372307,7/15/2025,7/15/2025,7/15/2025,4,
Mirror Mirror,Gregory Maguire,,9780060988654,12/28/2023,2/14/2023,2/14/2023,4,
Prophet Song,Paul Lynch,,9780861546459,5/27/2026,5/27/2026,5/27/2026,3,
Somewhere Beyond the Sea,TJ Klune,,9781250881205,11/16/2024,11/16/2024,11/16/2024,5,"<div>Somewhere Beyond the Sea by TJ Klune--I'm holding back tears as I'm writing this. I don't think I've ever been more moved by a book. Analytically, this sequel to The House in the Cerulean Sea works because the reader already knows the characters well and little preamble is necessary. But more to the point, the story, the characters, the setting, it all combines to be...triumphant. Joyfully so. Unapologetically so. It stirs righteous anger while dripping unlike anything I've ever read with pure, unadulterated charm. I've read a lot of ""feel-good"" books, I've never read anything quite like this. Two thumbs up.</div>"
American Idolatry: How Christian Nationalism Betrays the Gospel and Threatens the Church,Andrew L. Whitehead,,1587435764,12/29/2023,10/17/2023,10/17/2023,4,
Lost in Math: How Beauty Leads Physics Astray,Sabine Hossenfelder,,9780465094257,10/19/2024,10/19/2024,10/19/2024,4,"<div>Lost In Math by Sabine Hossenfelder--Challenging but accessible, this book examines the beauty fallacy, the idea, according to the author, that scientists get caught up in the beauty of equations, believing that an equation must be beautiful/simple in order to describe the universe at large. I got somewhat lost in the discussion of quantum mechanics, but in general, her point seems to be that some assumptions about how the universe might work aren't driven from any laws we know, but rather an implicit bias toward beauty and simplicity that dominates science as a whole. It's a fascinating idea, and one that is discussed thoroughly in these pages. Thumbs up.</div>"
I'm Glad My Mom Died,Jennette McCurdy,,9781982185848,12/28/2023,4/16/2023,4/16/2023,5,
Better The Devil,Erik J. Brown,,,2/1/2026,2/1/2026,2/1/2026,4,
Coldwire,Chloe Gong,,9781399732352,12/29/2025,12/29/2025,12/29/2025,3,"<div>I didn't love the perspective shifting here. It's an interesting first book to a trilogy, but I don't think I'll continue.&nbsp;</div>"
The Amazing Story of Quantum Mechanics: A Math-Free Exploration of the Science that Made Our World,James Kakalios,,9781592404797,12/29/2024,12/29/2024,12/29/2024,4,"<div>The Amazing Story of Quantum Mechanics by James Kakalios--Charming and informative, this book explores quantum mechanics through the framing of comics written contemporaneously with some of the biggest scientific discoveries of the twentieth century. This framing device works well, as Kakalios can dive into what's wrong--and surprisingly, what's right--about the pseudoscience that underpins the origins of heroes and villains both renowned and obscure. The explanations are delightful and down-to-earth, and Kakalios goes out of his way to connect dots and show how our understanding of quantum mechanics has led to everyday improvements in our lives. Thumbs up.</div>"
Gods and Mortals: Ancient Greek Myths for Modern Readers,Sarah Iles Johnston,,9780691199207,10/8/2025,,,4,
Only Human,Sylvain Neuvel,,9780399180118,12/29/2023,8/9/2023,8/9/2023,3,
The Mask of Fear,Alexander Freed,,9780593723463,8/26/2025,8/26/2025,8/26/2025,4,
The Butcher's Masquerade,Matt Dinniman,,9780593955994,10/6/2025,10/6/2025,10/6/2025,4,
Long Island Compromise,Taffy Brodesser-Akner,,9780593133491,12/25/2024,12/24/2024,12/24/2024,4,"<div>Long Island Compromise by Taffy Brodessor-Akner--Steeped in Jewish-Americsn family life, this book tackles a whole lot of subjects and handles them with charm without shying away from their heaviness. Trauma, the meaning of a life well-lived, capitalism, and a family's collective experience are all served up and lived in this book that almost feels like the pages melt away while reading. I don't normally love this kind of book, but I do recommend it. Thumbs up.</div>"
